{
  "title": "Hurricane Harvey Social Media Response Dataset",
  "abstract": "Analysis of social media responses during Hurricane Harvey",
  "creator": "Dr. Jane Example, University of Example",
  "subject_category": "Emergency Management",
  "geographic_coverage_controlled": ["Gulf Coast"],
  "temporal_coverage_start": "2017-08-25"
}
